family,data_requirement,learned_object,correction,representative_papers,strongest_supported_claim,main_boundary
SPS,data-free,forward/backward path drifts,extended-space IMH,2606.13790,Corrected independent proposals match tested HMC observables with shorter critical-region autocorrelation.,One 2D phi4 study; support tails and total-cost comparison remain open.
Path-space control/data-free diffusion,data-free,stochastic control or reverse path,trajectory weights,2111.15141;2302.13834;2307.01050;2410.02711,Path objectives can lower weight variance for unnormalized targets.,"Discretization, training and transfer to lattice physics vary by method."
Normalizing-flow MCMC,data-free,terminal invertible map,MH or reweighting,1904.12072;2003.06413;2106.05934;2208.03832,Learned independent proposals can be corrected and made symmetry aware.,"Training, support and realistic-QCD scaling remain unresolved."
Stochastic normalizing flow,data-free,interleaved maps and stochastic protocol,Jarzynski/reweighting,2201.08862;2409.18861;2601.20708,Learned layers improve tested nonequilibrium estimators while retaining correction.,Protocol length and updated degrees of freedom can dominate cost.
Physics/symmetry diffusion,usually target-data trained,score or reverse drift,reweighting or MALA/HMC refinement,2309.17082;2502.05504;2510.26081;2607.08505,"Symmetry, forces and cross-volume training improve tested sample quality.",Raw samples can remain biased and score/correction cost is substantial.
Autoregressive network,data-free,conditional density,MH,2512.19575,Sequential models plus MH reproduce tested scalar/spin observables.,Small systems; no realistic gauge/fermion scaling.
Multiscale generative flow,data-free,coarse-to-fine hierarchy,importance sampling and MLMC,2604.10209,Explicit scale separation improves the reported near-critical scalar benchmark.,One 2D scalar setting; fine-level ESS still declines.
Diagnostics/theory,reference data or analytic target,failure modes or training dynamics,none,2107.00734;2605.12597;2607.08505,Mode-resolved diagnostics and controlled theory reveal failures hidden by aggregate metrics.,They diagnose or explain failure but are not complete samplers.
