gap_id,gap,why_it_matters,current_evidence,next_search_or_experiment,status,evidence_ids
G01,Production-scale 4D QCD with dynamical fermions,This is the target regime where critical slowing and determinant cost matter most.,2106.05934;2208.03832;2604.12416,Benchmark gauge-equivariant path samplers with pseudofermions at increasing volume and lattice spacing.,open,E-210605934-L;E-220803832-L;E-260412416-L
G02,Observable-level error per total compute,High ESS can coexist with poor errors for selected observables or hidden training cost.,2211.07541;2605.11199;2604.10209,Use matched schedules/seeds and report block errors times training+sampling GPU-hours.,open,E-221107541-L;E-260511199-L;E-260410209-L
G03,"Support, tail and multimodal robustness",Learned proposals can miss low-probability regions that dominate reweighting or susceptibility.,2107.00734;2606.13790;2510.21330,"Add target-sample diagnostics, tail-weight tests and operator-resolved gates before promotion.",open,E-210700734-L;E-260613790-L;E-251021330-L
G04,Infrared and zero-mode accuracy near criticality,Local/global summary statistics may hide the slow modes responsible for critical behavior.,2605.11199;2607.08505;2605.12597,Measure momentum-resolved residuals and architecture/locality scaling across L.,open,E-260511199-L;E-260708505-L;E-260512597-L
G05,Exact correction efficiency,A correction can restore correctness while erasing the generative speedup.,2606.13790;2502.05504;2607.08505,"Measure acceptance, weight variance, autocorrelation and correction cost jointly.",open,E-260613790-L;E-250205504-L;E-260708505-L
G06,Cross-volume and multiscale transfer beyond scalar theory,"Transfer could amortize training, but gauge and fermion structure may break scalar results.",2607.08505;2604.10209;2601.20708,"Test equivariant multiscale architectures on U(1), SU(2), then SU(3) with fixed physical volume.",open,E-260708505-L;E-260410209-L;E-260120708-L
G07,SPS forward-citation closure,"The root preprint is only one month old in this run, so direct descendants may not yet be indexed.",Q40 and current OpenAlex/web checks,Repeat forward-citation search after an indexing interval and after new SPS versions.,monitor,
G08,Public code/data and reproducibility,The root states that code and data will be made available in a future version.,2606.13790 PDF Research Data and Code Access statement,Recheck arXiv revisions and repositories before claiming reproducibility.,monitor,
G09,Uniform cross-paper cost benchmark,"Published numbers use different hardware, correction rules, observables and stopping conditions.",1904.12072;2211.07541;2409.18861;2604.10209,"Create a common runner with fixed target, sample count, error metric and compute accounting.",open,E-190412072-L;E-221107541-L;E-240918861-L;E-260410209-L
